{
  "schema_version": 1,
  "evidence_id": "EVID-WP0001-PRE-A1-20260716",
  "packet_id": "WP-0001",
  "observed_at": "2026-07-16T08:29:46Z",
  "observation_mode": "read-only-filesystem-log-and-process-inspection",
  "overall_status": "blocked",
  "activation_authority": false,
  "contains_secret_values": false,
  "authority_binding": {
    "base_commit": "3e336ce7f5bf9823fde57b3a3f016945696399d9",
    "packet_contract_sha256": "eed333603affe6aa1dd2b16b26ae702d9f561cc653fa319da02abfe008faeda3",
    "active_route": "UNITY-MCP-EXTERNAL",
    "route_decision_id": "D-0051",
    "route_receipt_ids": [
      "RR-D0051-20260716",
      "RR-WP0001-ROUTE-20260716"
    ],
    "current_autonomy": "A0",
    "a1_activation_receipt_id": null
  },
  "host_environment": {
    "os": "macOS",
    "os_version": "15.7.7",
    "architecture": "arm64",
    "hardware": "Apple M3 Max",
    "memory_gb": 48,
    "rosetta_present": true
  },
  "toolchain": [
    {
      "id": "UNITY-HUB",
      "required": "3.19.5",
      "observed": "3.19.5",
      "status": "matched",
      "evidence": [
        "Unity Hub application-bundle version"
      ]
    },
    {
      "id": "UNITY-EDITOR",
      "required": "6000.3.19f1 changeset 7689f4515d75 ARM64",
      "observed": "6000.5.4f1 changeset d550df8bd089 ARM64",
      "status": "mismatch",
      "evidence": [
        "/Users/sasha/Sashas/ProjectSettings/ProjectVersion.txt",
        "installed Editor application-bundle inspection"
      ]
    },
    {
      "id": "MAC-BUILD-SUPPORT-IL2CPP",
      "required": "Mac Build Support (IL2CPP) for Unity 6000.3.19f1",
      "observed": "absent; installed Mac player variations are Mono-only",
      "status": "missing",
      "evidence": [
        "installed Editor PlaybackEngines directory inspection"
      ]
    },
    {
      "id": "XCODE",
      "required": "full Xcode 26.3",
      "observed": "full Xcode absent; active developer directory is /Library/Developer/CommandLineTools",
      "status": "missing",
      "evidence": [
        "/Applications/Xcode.app absence",
        "xcode-select and xcodebuild read-only preflight"
      ]
    },
    {
      "id": "DOTNET-SDK",
      "required": "10.0.301",
      "observed": null,
      "status": "missing",
      "evidence": [
        "dotnet executable not found on PATH"
      ]
    },
    {
      "id": "ROSETTA-2",
      "required": "installed where required by Unity Apple-Silicon tooling",
      "observed": "com.apple.pkg.RosettaUpdateAuto 1.0.0.0.1.1777570176",
      "status": "matched",
      "evidence": [
        "macOS package receipt"
      ]
    }
  ],
  "observation_project": {
    "path": "/Users/sasha/Sashas",
    "purpose": "observation-only-onboarding-project",
    "editor_version": "6000.5.4f1",
    "editor_changeset": "d550df8bd089",
    "company_name": "DefaultCompany",
    "product_name": "Sashas",
    "bundle_identifier": null,
    "organization_id_sha256": "9b502c7e60d87721337fb9836a5bcfbaa6624d472e480de7ecbb328bf97d622a",
    "cloud_project_id_sha256": "0bc8f812dc0be6e99edcea952518fe09437762f5353d450c76e0e62992ab56e1",
    "unity_connect_enabled": false,
    "matches_wp0001_temporary_identity": false,
    "same_organization_project_linkage_verified": false
  },
  "package_graph": {
    "manifest_path": "/Users/sasha/Sashas/Packages/manifest.json",
    "manifest_sha256": "bc0a9207b56a53b5dc00045eb057dcf10bec4558bec7ae97039b3c56ae1d2e59",
    "lock_path": "/Users/sasha/Sashas/Packages/packages-lock.json",
    "lock_sha256": "6a97aea36ac4663cdfa912cf7067a9d98d3c9d9291cffce285a9ca391011bd00",
    "packages": [
      {
        "id": "UNITY-AI-ASSISTANT",
        "required": "com.unity.ai.assistant 2.14.0-pre.1 from Unity Registry",
        "observed": "com.unity.ai.assistant 2.14.0-pre.1",
        "status": "matched",
        "evidence": [
          "manifest and Editor-generated package lock"
        ]
      },
      {
        "id": "URP",
        "required": "com.unity.render-pipelines.universal 17.3",
        "observed": "com.unity.render-pipelines.universal 17.5.0",
        "status": "mismatch",
        "evidence": [
          "manifest and Editor-generated package lock"
        ]
      },
      {
        "id": "UNITY-TEST-FRAMEWORK",
        "required": "com.unity.test-framework 1.6",
        "observed": "com.unity.test-framework 1.7.0",
        "status": "mismatch",
        "evidence": [
          "manifest and Editor-generated package lock"
        ]
      }
    ]
  },
  "direct_mcp_route": {
    "selected_route": "UNITY-MCP-EXTERNAL",
    "bridge": {
      "state": "running",
      "connection_file": "/Users/sasha/.unity/mcp/connections/bridge-9f46638e-24947.json",
      "connection_file_sha256": "8b3a94bac0f49559d0758f16b07cdf1f153e016c71daf7939e73f0f5e50f1cb6",
      "protocol_version": "2.0",
      "connection_type": "named_pipe",
      "endpoint": "/tmp/unity-mcp-9f46638e-24947",
      "project_path": "/Users/sasha/Sashas",
      "expected_project_target": "receipt-bound standalone WP-0001 A1 clone/Game",
      "target_matches_wp0001": false
    },
    "relay": {
      "path": "/Users/sasha/.unity/relay/relay_mac_arm64.app/Contents/MacOS/relay_mac_arm64",
      "sha256": "e52d9dc5380297456dc9ae168bdc981e7344651e653b73424dd4bc88df26eaf1",
      "package_copy_sha256": "e52d9dc5380297456dc9ae168bdc981e7344651e653b73424dd4bc88df26eaf1",
      "matches_package_copy": true,
      "version": "1.0.12-build.96",
      "architecture": "arm64",
      "bundle_identifier": "com.unity.ai.assistant.relay",
      "team_identifier": "9QW8UQUTAA",
      "observed_arguments": [
        "--relay",
        "--port",
        "9001",
        "--mcp-client-port",
        "9002",
        "--editor-pid",
        "24947",
        "--shutdown-delay",
        "180",
        "--log-dir",
        "/Users/sasha/Sashas/Logs"
      ],
      "direct_mcp_mode_active": false
    },
    "external_client": {
      "path": "/Applications/ChatGPT.app/Contents/Resources/codex",
      "sha256": "bdcb530615d44fcc7b35d12fe00f30c3025c25fc22a21193591dcdb064304385",
      "version": "codex-cli 0.144.5",
      "publisher": "OpenAI OpCo, LLC",
      "exact_version_first_approval_verified": false
    },
    "repository_config": {
      "path": ".codex/config.toml",
      "sha256": "c8b3e2bb9d914d2deba6fbd2119a4cd02a6771fd4d5a5f3110cccffe94b931c0",
      "enabled": false,
      "configured_target": "/REPLACE-WITH-RECEIPT-BOUND-A1-CLONE/Game",
      "global_unity_mcp_present": false
    },
    "network_listeners": [
      {
        "role": "relay",
        "transport": "tcp",
        "address": "127.0.0.1",
        "port": 9001,
        "exposure": "loopback",
        "state": "listening"
      },
      {
        "role": "mcp-client",
        "transport": "tcp",
        "address": "*",
        "port": 9002,
        "exposure": "all-interfaces",
        "state": "listening"
      }
    ],
    "session_history": {
      "connected_direct_clients": 0,
      "historical_handshakes_observed": 33,
      "handshakes_with_zero_tools_observed": 2,
      "handshakes_with_full_toolset_observed": 31,
      "handshake_tool_count": 54,
      "minimal_scope_verified": false,
      "approval_history_state": "inherited-auto-approval-observed",
      "zero_tool_clean_handshake_verified": false,
      "unity_tool_invocations_before_activation": 1
    },
    "entitlement_and_linkage": {
      "unity_editor_license_observed": true,
      "eligible_unity_ai_seat": "unverified",
      "same_organization_project_linkage": "unverified",
      "license_secret_material_copied": false
    }
  },
  "deviations": [
    {
      "id": "DEV-MCP-READCONSOLE-001",
      "observed_on": "2026-07-16",
      "occurred_at": "2026-07-16T07:10:18.186Z",
      "category": "pre-activation-unity-tool-call",
      "action": "Unity_ReadConsole",
      "result": "completed successfully at 2026-07-16T07:10:19.102Z",
      "project_mutation_state": "unknown-no-mutation-observed",
      "mcp_tool_invocation": true,
      "activation_evidence_eligible": false,
      "preservation_status": "preserved",
      "clean_cycle_required": true,
      "notes": "This A0 read-only smoke was not authorized as activation evidence and cannot satisfy the required zero-tool setup handshake."
    },
    {
      "id": "DEV-DIRECT-UNITY-VERSION-001",
      "observed_on": "2026-07-16",
      "occurred_at": null,
      "category": "prohibited-direct-unity-process-invocation",
      "action": "/Applications/Unity/Hub/Editor/6000.5.4f1/Unity.app/Contents/MacOS/Unity -version",
      "result": "returned 6000.5.4f1; no MCP call, project mutation, or implementation is known",
      "project_mutation_state": "unknown-no-mutation-observed",
      "mcp_tool_invocation": false,
      "activation_evidence_eligible": false,
      "preservation_status": "preserved",
      "clean_cycle_required": true,
      "notes": "Direct agent invocation of Unity is prohibited. The exact execution timestamp was not retained, so this observation preserves only the date and command result."
    },
    {
      "id": "DEV-DIRECT-UNITY-HUB-001",
      "observed_on": "2026-07-16",
      "occurred_at": null,
      "category": "prohibited-direct-unity-process-invocation",
      "action": "/Applications/Unity Hub.app/Contents/MacOS/Unity Hub -- --headless editors -i",
      "result": "returned no output; no installation, project mutation, MCP call, or implementation is known",
      "project_mutation_state": "unknown-no-mutation-observed",
      "mcp_tool_invocation": false,
      "activation_evidence_eligible": false,
      "preservation_status": "preserved",
      "clean_cycle_required": true,
      "notes": "A read-only preflight incorrectly launched Unity Hub despite the direct-invocation prohibition. The result is preserved and cannot support activation."
    }
  ],
  "blockers": [
    {
      "id": "BLK-D0047-EDITOR",
      "domain": "toolchain",
      "status": "blocking",